id,title,author,day,genre,story,platform,webtoon_url,thumbnail_url
257,후작님을 녹이는 방법,"할머, 슈지첼",X(완결),로맨스,"차갑고 수상한 성에서 펼쳐지는 생존 로맨스?!귀요미와 허당 매력이 가득한 사랑 듬뿍 받고 자란 막내 아들, 백작 가문의 사생아 출신 에이드리안. 첫째 형은 사망, 둘째 형은 실종되면서 가문의 땅을 지키기 위해 어쩔 수 없이 황제파 귀족 가문과 결혼할 수밖에 없는 처지에 놓인다. 둘째 형이 돌아올 때까지만 버틸 생각으로, 당연히 거절할 거라 생각한, “얼굴을 보면 죽인다”는 악명 높은 전장의 늑대, 프레이 뷔시아 후작을 결혼 상대로 지정하는 에이드리안. 하지만 프레이 후작이 대체 무슨 생각에선지 덜컥 결혼 서명을 해버리면서 에이드리안과 프레이는 거짓말처럼 진짜 “결혼”이란 것을 하고 만다! 으악! 망했다!!! 머리 뜯는 고통의 시간도 잠시…이제 무를 수도 없이 부부인데…….근데 진짜 궁금한 게…왜 얼굴은커녕 머리카락 하나 보기 힘든 거죠? 왜 얼어 죽을 뻔한 사람을 구해줘가지고 사람 마음을 들었다 놨다 하는 거죠? 얼굴을 보면 죽인다는 소문의 주인공 프레이 뷔시아 후작. 차가워도 너무 차가운 그녀의 마음을 과연 이 허술한 에이드리안이 녹일 수 있을까?",네이버,https://comic.naver.com/webtoon/list?titleId=791116,https://shared-comic.pstatic.net/thumb/webtoon/791116/thumbnail/thumbnail_IMAG06_f05fb11e-5140-44e7-aab6-9022d3598625.jpg
258,인간대전,김성모,X(완결),액션,"2021년, 전 세계에 대한 러시아의 핵도발로 세계 제3차 핵전쟁이 발발하였다.수십, 수백 발의 핵폭탄이 지구를 강타했고 인류는 멸각당했다.그러나 인류는 핵 방사능에 오염된 상태에서도 간신히 1/10 살아남았고, 그들을 지배하는 원시적인 폭력조직 4대폭조가 생겼는데…",네이버,https://comic.naver.com/webtoon/list?titleId=784821,https://shared-comic.pstatic.net/thumb/webtoon/784821/thumbnail/thumbnail_IMAG06_89a2854b-453c-461f-8dec-2fda93a4057f.jpg
259,2022 서브병에 빠지다!,웹툰작가,X(완결),개그,"서브병에 걸린 사람들 모두 모여라!​우리가 주인공들만큼 사랑했던 서브캐들. 로맨스부터 액션, 개그 웹툰까지!주인공 뒤에 가려져 있었지만 누구보다 작품을 빛내주었던 그들의 매력발산이 시작된다!",네이버,https://comic.naver.com/webtoon/list?titleId=787411,https://shared-comic.pstatic.net/thumb/webtoon/787411/thumbnail/thumbnail_IMAG06_fdafb9ae-0fc3-4b59-950d-588a2b17195d.jpg
260,강림전기 개정기,"철무장미, 장군",X(완결),액션,"얼굴 학력 성품 모든 것이 완벽한 전교 1등 우등생 하린.그런 그의 옆자리를 차지한 괴상한 전학생이, 오늘부터 하린을 죽이겠다는데?!무협 소설 <강림전기>에서 튀어나온 악마, 최강림과의 파란만장 학교생활 판타지.",네이버,https://comic.naver.com/webtoon/list?titleId=762777,https://shared-comic.pstatic.net/thumb/webtoon/762777/thumbnail/thumbnail_IMAG06_7454d8a8-90b8-4d5b-837b-00efd5d454eb.jpg
261,탈영일지,아포리아,X(완결),드라마,1984년 군생활을 이어가던 ‘최금혁’은 선임들의 모진 갈굼과믿었던 여자친구의 배신으로 매일 지옥 같은 하루를 보낸다.괴로운 생활에 지친 금혁이는 근무 중 선임의 조롱을 견디지 못하고 결국 선임을 쏘고 달아나게 되는데...은신과 도주가 반복되는 생활 속에서 금혁이는 무사히 추격자들을 따돌릴 수 있을까?​괴로운 군생활에서 도망쳐 나온 탈영병 최금혁과 그를 쫓는 조충호 대위의 추격 스릴러!,네이버,https://comic.naver.com/webtoon/list?titleId=773523,https://shared-comic.pstatic.net/thumb/webtoon/773523/thumbnail/thumbnail_IMAG06_1d09d15b-f562-470a-8a54-28b4fe6f3581.jpg
262,용돈이 계속 늘어!,"쾌벌, 신혜",X(완결),드라마,누가 나한테 자꾸 용돈을 준다.  돈이 최고야! 늘 새로워! 짜릿해! 앞으로 내 인생 탕진잼만 누리며 살면 되는 거야? 백수 표본 김여유의 플렉스 이야기(?).,네이버,https://comic.naver.com/webtoon/list?titleId=789988,https://shared-comic.pstatic.net/thumb/webtoon/789988/thumbnail/thumbnail_IMAG06_5a3fc7c1-f820-4be6-b7b7-1fc11815300e.jpg
263,행운소년소녀,S위밍,X(완결),무협/사극,"[ 운을 공유하는 쌍둥이 이야기 ]내가 사랑하는 사람이 불행해져야 내가 행복해질 수 있다면...? 쌍둥이, 비량과 비별의 수장이 되기 위한 행운 매치.",네이버,https://comic.naver.com/webtoon/list?titleId=789989,https://shared-comic.pstatic.net/thumb/webtoon/789989/thumbnail/thumbnail_IMAG06_4443333a-bd53-4b8a-bbda-766a24785387.jpg
264,보살님이 캐리해!,"성코, 콩자",X(완결),액션,억겁의 시간을 넘어 환생한 보살들이여 야차들의 습격에서 평화로운 일상과 법화를 수호하라!,네이버,https://comic.naver.com/webtoon/list?titleId=756790,https://shared-comic.pstatic.net/thumb/webtoon/756790/thumbnail/thumbnail_IMAG06_ee6e6d2f-ab04-48d9-9f91-7486af01ca01.jpg
265,피와 나비,레민,X(완결),판타지,"어느 날 나타난 정체불명의 괴물 '벌레'와, 그에 맞서는 힘을 가진 '나비'의 아이들.",네이버,https://comic.naver.com/webtoon/list?titleId=749633,https://shared-comic.pstatic.net/thumb/webtoon/749633/thumbnail/thumbnail_IMAG06_6e1b7045-b59c-4eae-9ecf-7e37e1d11778.jpg
266,시효완성,"삼바, 미스터리, 담",X(완결),드라마,"과거 우발적으로 살인을 저질렀던 국회의원 원동혁.2015년 현재 '공소시효 폐지 법안'을 다루던 그는 한 통의 메시지를 받는다.""나는 네가 15년 전 한 일을 알고 있다.""",네이버,https://comic.naver.com/webtoon/list?titleId=756606,https://shared-comic.pstatic.net/thumb/webtoon/756606/thumbnail/thumbnail_IMAG06_8ee78875-baf4-4f06-b1a1-fdb5ef850dd1.jpg
267,스캔들,"티바, 도그, 달콤J",X(완결),로맨스,"당대 최고 인기 여배우의 스캔들의 주인공이 내 남편이라면?남편의 불륜으로 신혼이 파탄난 지우는 기자생활을 접고 미국으로 떠나게 되고, 전 남편이 거절할 수 없는 제안을 건네온다.",네이버,https://comic.naver.com/webtoon/list?titleId=751642,https://shared-comic.pstatic.net/thumb/webtoon/751642/thumbnail/thumbnail_IMAG06_21b06c78-61af-48d8-be8b-d19d7f9402bf.jpg
268,오파츠,"성진, 부겸",X(완결),판타지,"이 세상에 존재할 수 없는 물건인 ‘오파츠’를 소유한 이들. 그들이 살아가는 세상인 경계의 밖(Out), 그곳에서 일어난 수많은 특별한 이야기.",네이버,https://comic.naver.com/webtoon/list?titleId=744381,https://shared-comic.pstatic.net/thumb/webtoon/744381/thumbnail/thumbnail_IMAG06_f50ec02d-57cf-4116-9164-3f5e72235193.jpg
269,W : 너와 나의 세계,"주니버스, 이채",X(완결),로맨스,"만화가인 아빠의 작품 중에서 강철이 최애캐인 연주는 평범한 일상을 보내던 어느 날 생일파티를 하게 되었다. 그런데 잠깐 잠이 든 사이에 이상한 곳에서 눈을 뜨게 되고 눈앞에는 만화 속에만 보던 캐릭터 주인공, 강철이 서있었다. 정신 차려보니 이곳은 현실이 아닌 만화 속 세계랑 너무 똑같았다.",네이버,https://comic.naver.com/webtoon/list?titleId=789986,https://shared-comic.pstatic.net/thumb/webtoon/789986/thumbnail/thumbnail_IMAG06_7bc63df2-025b-48b4-84bb-08a1900b9a1b.jpg
270,평행우주,현용민,X(완결),개그,"체구도 작고 공부도 못 하는 17살의 '이우주'는 어느 날, 자신을 괴롭히는 ‘표영배’ 녀석들에게 쫓겨 학교 뒷산 낭떠러지에서 떨어진다.얼마 후, 정신을 차리고 일어나 보니 세상은 달라져 있었다. 바로 거꾸로 나이를 먹는 평행우주 속 지구로 떨어진 것. 졸지에 이방인이 된 우주는  과연 원래의 세계로 돌아올 수 있을까?",네이버,https://comic.naver.com/webtoon/list?titleId=789987,https://shared-comic.pstatic.net/thumb/webtoon/789987/thumbnail/thumbnail_IMAG06_45363bef-175d-410f-991f-6751ffcb20b0.jpg
271,트리거,고경빈,X(완결),판타지,"지구에 소행성이 떨어진 후, 지구는 인간을 먹이로 하는 괴생명체 '아니스'에 의해 절멸 위기에 처한다.청소년 모두가 입대해서 아니스에 맞서야 하는 시대. 1년 전 먼저 입대한 소꿉친구 니카와 어렵게 재회한 에반은니카가 자신을 전혀 기억하지 못하는데다, 더이상 평범한 인간이 아니라는것을 알게 된다.충격에 빠진 에반에게 정부에서 준 임무는 니카를 죽이라는 것이다. 그것도 매일, 인류를 위해..",네이버,https://comic.naver.com/webtoon/list?titleId=764480,https://shared-comic.pstatic.net/thumb/webtoon/764480/thumbnail/thumbnail_IMAG06_31960fe0-e93f-48ad-9236-391e732ec53f.jpg
272,겟라이프,MOOHAK,X(완결),판타지,"그 것은... 소년들을 빛나게 하기도, 고통스럽게 하기도 하였다.축복과 혼돈의 힘 '라이프'! 이를 둘러싼 음모와 대전쟁의 시작.",네이버,https://comic.naver.com/webtoon/list?titleId=733076,https://shared-comic.pstatic.net/thumb/webtoon/733076/thumbnail/thumbnail_IMAG06_db3f2782-b9c0-4730-a1be-ed0216271c3a.JPG
273,자판귀,윤정민,X(완결),스릴러,"자판기에서 내가 원하는 것이 나온다!?데뷔를 꿈꾸는 연습생 박도영. 대표의 비리로 데뷔가 무산되자, 만취한 상태로 골목길을 헤매다 수상한 자판기를 보게 되는데...",네이버,https://comic.naver.com/webtoon/list?titleId=703850,https://shared-comic.pstatic.net/thumb/webtoon/703850/thumbnail/thumbnail_IMAG06_fb5b9cec-432d-49c6-8215-8c05d6c8494c.jpg
274,잔인한 축제,희나리,X(완결),드라마,"아름다운 벚꽃이 흩날리는 K시 축제의 날,그녀의 핏빛 복수가 시작된다. 나에게도 그들에게도 잔인한 하루. 하드보일드 성인극화.",네이버,https://comic.naver.com/webtoon/list?titleId=789428,https://shared-comic.pstatic.net/thumb/webtoon/789428/thumbnail/thumbnail_IMAG06_ef186d7e-5139-490b-b146-c5da8b87fbfd.jpg
275,맥시멈퓨리,희나리,X(완결),드라마,"미국 샌프란시스코를 무대로 세계 최대의 Pride 축제일에 펼쳐지는 하드코어 액션 드라마. 무자비한 복수가 불러온 참혹의 대서사시. 거대한 스케일의 초대형 웹툰버스터,잔인한 축제 2부",네이버,https://comic.naver.com/webtoon/list?titleId=789429,https://shared-comic.pstatic.net/thumb/webtoon/789429/thumbnail/thumbnail_IMAG06_b5013447-183c-45c6-8767-834af6e5dd2a.jpg
276,달빛세면소,나와,X(완결),로맨스,"정규직 전환을 앞두고 회사에서 부당 해고를 당한 ‘윤이나’는 좌절감에 빠져 집에 가던 중,평소 야근을 할 때마다 환하게 불을 밝히던 의문의 가게에 들어서고.그곳이 지친 마음도, 피부도 사르르 녹여준다는 소문이 무성하던클렌징 샵 ‘달빛세면소’ 란 걸 알게 된다.이나는 그곳에서 호기심 반, 신기함 반으로 세면소 사장 ‘현두’에게 클렌징을 받으며그의 따스한 손길과 멘트에 큰 위로를 받는다.하지만 이 남자…어딘지 좀 이상하다? 클렌징을 받다 깜빡 잠이 든 자신을 기다리다 잠이 든 그를 깨운 뒤 집으로 향하던 길,현두는 이나를 붙잡곤 다짜고짜 자신을 재워달라 부탁하는데…?!그에겐 과연 어떤 사연이 있는 걸까?오직 나만이 잠재울 수 있는 존잘남과의 3개월 계약 동거 시작♡",네이버,https://comic.naver.com/webtoon/list?titleId=789430,https://shared-comic.pstatic.net/thumb/webtoon/789430/thumbnail/thumbnail_IMAG06_c20d80ec-c824-41a3-9c77-b2a9e21850db.jpg
277,매지컬 메디컬,지공,X(완결),드라마,날 구하러 온 마법 세계 힐러,네이버,https://comic.naver.com/webtoon/list?titleId=753806,https://shared-comic.pstatic.net/thumb/webtoon/753806/thumbnail/thumbnail_IMAG06_3dcf6b9a-19bd-4aed-8c2d-541c9a1631e5.jpg
278,속보입니다,"Z6, 밀카",X(완결),로맨스,"평범한 대학생 '예슬'은 대한민국에서 모르면 간첩이라는최연소 메인뉴스 아나운서 '김민준'을 만나기 위해 방송국 카페에서 아르바이트를 시작한다.그러나 민준은 기대했던 것과는 다르게 너무 차갑기만 하고…제가 얼마나 오랜 기간 좋아했는데, 왜 이렇게 차갑게 구시는 거예요?",네이버,https://comic.naver.com/webtoon/list?titleId=755758,https://shared-comic.pstatic.net/thumb/webtoon/755758/thumbnail/thumbnail_IMAG06_fe650064-e0e8-442f-896c-1d6f58b80c22.jpg
279,안식의 밤,연제원,X(완결),스릴러,노인들을 대상으로 한 연쇄 살인 사건의 전말'나는 할머니를 죽이지 않았어요!!',네이버,https://comic.naver.com/webtoon/list?titleId=738483,https://shared-comic.pstatic.net/thumb/webtoon/738483/thumbnail/thumbnail_IMAG06_973b0ef3-0ba1-4177-b8af-dd29275ee309.jpg
280,달콤살벌한 부부,"장그린, 플라비",X(완결),로맨스,"학창 시절 내내 앙숙이었던 남자, 10년 만에 나타나 거절키 어려운 조건으로 쇼윈도 부부를 제안하다.",네이버,https://comic.naver.com/webtoon/list?titleId=753856,https://shared-comic.pstatic.net/thumb/webtoon/753856/thumbnail/thumbnail_IMAG06_60d15f8c-6725-4067-a978-1309035a85f8.jpg
281,지원이들,구리,X(완결),일상,"평범한 고등학생 정지원은 자신과는 조금씩 다른 '지원이들'을 만난다.천사 같은 유지원과 웃긴 김지원, 완벽한 친구들을 사귀었다고 생각했는데...왜 자꾸 비교하게 되고 질투가 나는 걸까?그 시절 누구나 품었을 미운 마음을 담은 일상개그드라마!",네이버,https://comic.naver.com/webtoon/list?titleId=775337,https://shared-comic.pstatic.net/thumb/webtoon/775337/thumbnail/thumbnail_IMAG06_6df1dc86-75b8-4021-810b-9525e974b642.jpg
282,라나,"서이레, SangFeel",X(완결),판타지,"사이보그와 로봇만이 존재하는 먼 미래의 시대, 사이보그가 된 뒤 기억을 모두 잃은 요한이 냉동 보관되었던 마지막 인간 라나를 깨우게 되면서 멈춰있던 운명의 톱니바퀴가 다시 돌아가기 시작한다.",네이버,https://comic.naver.com/webtoon/list?titleId=789425,https://shared-comic.pstatic.net/thumb/webtoon/789425/thumbnail/thumbnail_IMAG06_835c4708-55bb-4655-941f-1373996b87fe.jpg
283,보에,"서이레, 서기진",X(완결),감성,유리천장에 머리를 부딪치며 살아온 두 여자가 의기투합해 뷰티 편집샵 사업을 일구어나가는 성공기!,네이버,https://comic.naver.com/webtoon/list?titleId=789426,https://shared-comic.pstatic.net/thumb/webtoon/789426/thumbnail/thumbnail_IMAG06_0188b1b5-5526-4ef2-b03d-35b8c32f0de9.jpg
284,소녀행,"이레, 라미아",X(완결),로맨스,"다른 사람을 사랑하지도, 다른 사람에게 사랑받지도 못하는 저주를 타고 태어난 소녀, 혜.저주를 풀기 위해 홀로 여행길에 오른 혜는 '좋아한다'며 따라다니겠다고 하는 남자, 원을 만난다. 자신을 따라다니면 죽는다는 혜의 협박에도 원은 끈질기게 혜를 쫓는다.원과 투닥대며 저주의 비밀을 푸는 데 한 발짝씩 다가가던 혜는 자신의 운명과 원에 관한 놀라운 사실을 알게 된다.",네이버,https://comic.naver.com/webtoon/list?titleId=789427,https://shared-comic.pstatic.net/thumb/webtoon/789427/thumbnail/thumbnail_IMAG06_35b1ba5a-19c5-4bf3-9180-5e92cb9a7275.jpg
285,빨리감기,"포르토,홍준기, 홍준기",X(완결),스릴러,시간을 빨리감을 수 있는 명지는 하굣길에 시간을 빨리 감았다가 방금 죽어버린 친구를 앞에 둔 채 정신을 차린다. 영문을 몰라 당황하는 그녀의 앞에 누군가 나타나는데...시간을 조종할 수 있는 또 다른 능력자들의 위협으로부터 명지는 자신과 주변을 지키기 위한 긴박한 싸움을 시작한다.,네이버,https://comic.naver.com/webtoon/list?titleId=764040,https://shared-comic.pstatic.net/thumb/webtoon/764040/thumbnail/thumbnail_IMAG06_354ee5e0-194b-4b41-a626-3ec82fa2491d.jpg
286,가슴털 로망스,갸오오,X(완결),개그,최고의 상남자가 되기 위한 여행을 떠나는 장호풍과 친구들명언범벅 눈물범벅 의리범벅 개그만화!,네이버,https://comic.naver.com/webtoon/list?titleId=729963,https://shared-comic.pstatic.net/thumb/webtoon/729963/thumbnail/thumbnail_IMAG06_ddf1a0eb-d67e-4e89-87fc-5c46231482a0.jpg
287,변방의 외노자,"턍, 북국너구리, 후로스트",X(완결),판타지,"일하기가 싫다. 너무나도 싫다. 그러나 별 수는 없다.인간과 엘프, 오크와 트롤, 드래곤 등 외계인 이민자들이 한데 모여 살아가는 지구에는 날마다 사건이 끊이질 않는다.일 안 하면 죽는 남자의 위장취업 800년 차 고군분투기.",네이버,https://comic.naver.com/webtoon/list?titleId=780172,https://shared-comic.pstatic.net/thumb/webtoon/780172/thumbnail/thumbnail_IMAG06_cc643de7-e474-4c93-9521-61a09327421c.jpg
288,3cm 헌터,"돌연변이, 제이로빈",X(완결),판타지,"세상 사람들의 몸이 3cm로 줄어들었다. 이제는 고양이, 개미, 청소기 등 일상의 모든 것이 위협인 상황. 믿을 것은 각자에게 주어진 이능력 하나뿐이다.",네이버,https://comic.naver.com/webtoon/list?titleId=733458,https://shared-comic.pstatic.net/thumb/webtoon/733458/thumbnail/thumbnail_IMAG06_76e09f25-5935-453e-a1e4-c981c58ae3f3.jpg
289,드로잉 레시피,꼬모소이,X(완결),감성,어머니가 돌아가신후 어머니가 주인이었던 석촌 미선빌라 201호로 이사 온 은수의  용서와 성장의 힐링여행,네이버,https://comic.naver.com/webtoon/list?titleId=750493,https://shared-comic.pstatic.net/thumb/webtoon/750493/thumbnail/thumbnail_IMAG06_63b9b83b-07cd-47a1-8aee-07b324569d66.jpg
290,착한건 돈이된다,유성연,X(완결),드라마,"인기도 돈도 없는 삼류 스트리머 기찬수. 어느 날, 전 국민적 관심을 받던 '대낮 유괴사건'이 해결된다. 이를 해결한 '얼굴 없는 의인'은 CCTV 속 뒷모습만 남긴 채 사라졌고, 사람들의 궁금증은 점점 커져만 가는데... 사람들이 삼류 스트리머 기찬수의 영상 속 모습과 의인의 뒷모습이 유사함을 알게 되면서, 기찬수는 하루아침에 전 국민적 영웅이 된다. 기찬수의 영웅 행세는 과연 어디까지 갈 것인가.",네이버,https://comic.naver.com/webtoon/list?titleId=766575,https://shared-comic.pstatic.net/thumb/webtoon/766575/thumbnail/thumbnail_IMAG06_e5920f55-a8a3-450f-8358-63e26bd77e9c.jpg
291,이탄국의 자청비,"한집, 나넷, 김보람",X(완결),로맨스,"시공 초월 판타지 로맨스! 태권 소녀 자청비, 물푸레 향이 가득한 이세계 황궁에 떨어지다! 아는 사람 하나 없는 낯선 나라. 왕싸가지 꽃미남 황태자, 생명의 은인인 비운의 왕자, 놀기 좋아하는 말괄량이 공주 사이에서, 자청비는 집으로 돌아갈 수 있을까?",네이버,https://comic.naver.com/webtoon/list?titleId=759420,https://shared-comic.pstatic.net/thumb/webtoon/759420/thumbnail/thumbnail_IMAG06_58faa758-43e0-4c79-9a3b-b610c8bc093c.jpg
292,비인간,김케이,X(완결),드라마,"대규모 집회가 열린 광장에서 정체불명의 바이러스를 유포하던 '인광'은 뉴스팀 '혜나'와 '원식', 보안요원 '형주'에게 꼬리를 밟혀 잡히게 된다.이미 바이러스가 속수무책으로 퍼진 상황. 인광은 이 재난을 멈출 수 있는 유일한 희망이지만 일행은 인광을 혐오하고, 인광은 인간을 혐오한다.",네이버,https://comic.naver.com/webtoon/list?titleId=783022,https://shared-comic.pstatic.net/thumb/webtoon/783022/thumbnail/thumbnail_IMAG06_d091ec79-2ab7-4d39-8c21-2f36c25a3857.jpg
293,무능빌런,"흰여울, 이창준",X(완결),액션,사람을 해치지 못하는 사상 최강의 빌런?스스로를 빌런이라 칭하며 끝없이 어두운 내면을 탐구하는 고교생 김동진.그는 빌런으로선 매우 치명적인 약점을 가지고 있는데…,네이버,https://comic.naver.com/webtoon/list?titleId=784827,https://shared-comic.pstatic.net/thumb/webtoon/784827/thumbnail/thumbnail_IMAG06_9775e844-413a-495b-b8ef-5ba77931921b.jpg
294,성인초딩,미티,X(완결),드라마,32살 내 몸에 9살 나의 영혼이 들어왔다!대신 32살의 나는 게임기 안에 갇혀버렸네?!,네이버,https://comic.naver.com/webtoon/list?titleId=755601,https://shared-comic.pstatic.net/thumb/webtoon/755601/thumbnail/thumbnail_IMAG06_1d86487d-e0e3-428d-96d7-46e5f795083f.jpg
295,내 몸을 부탁해,김영삼,X(완결),액션,"학교 최강의 파이터와 전교 1등 모범생, 너무나 다른 두 소꿉친구의 몸이 바뀌어버렸다!과연 둘은 서로의 자리를 지키며 원래의 몸으로 돌아갈 수 있을까?키스를 하면 돌아가는 두 남녀의 화끈한 학원 액션 로맨스!",네이버,https://comic.naver.com/webtoon/list?titleId=787671,https://shared-comic.pstatic.net/thumb/webtoon/787671/thumbnail/thumbnail_IMAG06_aee0e8e8-aa3f-40a4-9931-211ac0bdc9a0.jpg
296,나만 보여!,LICO,X(완결),드라마,"학교 익명게시판이 나에게만 실명으로 보인다면?교내 익명 어플 ‘몰래몰래’에는 여러 가지 비밀들이 매일 익명으로 올라온다.10년째 소꿉친구인 '하영'을 짝사랑 중인 '민준'은 '몰래몰래' 다운로드 중 생긴 오류로 인해 익명 게시글들이 모두 실명으로 보이게 되고, '하영'의 남자친구인 '기주'가 바람피우고 있다는 충격적인 사실을 알게 되는데...",네이버,https://comic.naver.com/webtoon/list?titleId=763308,https://shared-comic.pstatic.net/thumb/webtoon/763308/thumbnail/thumbnail_IMAG06_957d4e38-ca6f-499d-88d4-1c3a7e5826e4.jpg
297,호수의 인어,박새,X(완결),로맨스,"수영선수를 꿈꾸는 담영은 대회를 앞두고 희소병이 재발한다.하지만 담영은 대회를 포기하지 못하고 학교에서 도둑 수영으로 훈련을 이어간다.그러던 어느 날 전학생 해수에게 도둑 수영을 들키게 되고, 담영은 해수의 비밀을 알게 된다.이후 담영과 해수는 서로의 비밀을 이용해 은밀한 계약 관계를 맺는다.",네이버,https://comic.naver.com/webtoon/list?titleId=771719,https://shared-comic.pstatic.net/thumb/webtoon/771719/thumbnail/thumbnail_IMAG06_fc138206-524a-4358-95ff-96d3cb16ea85.jpg
298,로그아웃,임목원,X(완결),스릴러,"인간이 상상하기 힘든 신기술들이 개발되고욕망을 충족해가는 사람들... 인류에게 주어진 선물일까, 저주일까",네이버,https://comic.naver.com/webtoon/list?titleId=733033,https://shared-comic.pstatic.net/thumb/webtoon/733033/thumbnail/thumbnail_IMAG06_e89d200f-ea69-4602-b08a-edeed1612da2.jpg
299,내 룸메이트는 마네킹,서이,X(완결),로맨스,"인간이 되고 싶은 마네킹 '도윤', 우연한 기회에 인형 공포증에 시달리는 '지호'와 만나 룸메이트가 된다. 도윤은 인간이 되고 지호는 트라우마를 극복해야만 한다. 두 남녀의 기묘한 동거는 성.공.적?!",네이버,https://comic.naver.com/webtoon/list?titleId=768466,https://shared-comic.pstatic.net/thumb/webtoon/768466/thumbnail/thumbnail_IMAG06_14338a52-5cc3-4cc3-a13d-7ac7ae8891d9.jpg
300,새벽 두 시의 신데렐라,"산차, 아이고메",X(완결),로맨스,"3년이나 사귄 연인인 서주원이 재벌가의 막내아들이란 것을 알게 된 지 두 달. 하윤서는 주원과 헤어지는 대가로 돈을 받는다. 그리고 실제로 헤어지기 위해 정 떨어지는 행동들을 하지만, 주원은 아랑곳하지 않고 윤서의 마음을 돌리려 노력하는데….",네이버,https://comic.naver.com/webtoon/list?titleId=752533,https://shared-comic.pstatic.net/thumb/webtoon/752533/thumbnail/thumbnail_IMAG06_81a5fc7e-2709-40fb-9531-0aadf54e7122.jpg
301,38의 살인,이승준,X(완결),스릴러,살인범을 죽이는 살인범 이사라와 범죄자를 증오하는 형사 차도형.30년전 도형의 부모를 살해한 진범에 대한 진실을 알게 된 이사라는 일부러 도형을 자극하며 그를 관찰하는데...,네이버,https://comic.naver.com/webtoon/list?titleId=787670,https://shared-comic.pstatic.net/thumb/webtoon/787670/thumbnail/thumbnail_IMAG06_d6ac98cb-5961-4734-bcee-e1d56d0b88ff.jpg
302,안드로이드는 혈이 없어,황동,X(완결),판타지,"차원이동 불시착으로 무협의 세계에 떨어진 가정용 첨단 안드로이드.배고픈 이들에게 음식을 만들어 주면서도 자신은 한 입도 먹지 않고(로봇이라)위험에 처한 사람들을 도우면서도 결코 살생을 하지 않으며(로봇의 3원칙에 따라)결코 잠들지도, 지치지도 않는(로봇이라…) 그 모습에 사람들은 그를 위대한 영웅으로 착각하고그런 안드로이드를 이용해 유명해지려는 무림의 허접 ‘경서’와 무림인들을 둘러싼피와 기름 냄새 가득한 무림 모험기(?)",네이버,https://comic.naver.com/webtoon/list?titleId=787722,https://shared-comic.pstatic.net/thumb/webtoon/787722/thumbnail/thumbnail_IMAG06_3d215031-952c-4809-8426-ba7fd9180095.jpg
